{
  "schemaVersion": 1,
  "reportType": "score-evasion-aggregate",
  "visibility": "public-aggregate",
  "mode": "shadow",
  "holdoutAccess": "none",
  "identity": {
    "sourceRevision": "d4bab4ede21cae2b25f03a40f466b52dceadfda2",
    "candidateArtifactHash": "3ffbb2f8adc90ee73b279a6fbd4357235488b50d18b3d2d389070220504bcebe",
    "scoringArtifactRevision": 2,
    "modelFingerprint": "bf2ed67db72dabe69b97d248e547aa1e942cf98991a6b712dc6285629662afa9",
    "scoringArtifactSha256": "a162be567245f9f6db6dbf4d2b3aec959408e06b64231d510e9612db0bb944e0",
    "tuningManifestHash": null,
    "scoringIdentity": "d6a8325c6cce09f628f595f88c5252245f0fbb5c01abb8ebb0eb0b7ec2e8a789"
  },
  "benchmark": {
    "commit": "5a161bfc9a0fbd17f91d4fc443e67308389b9609",
    "dirty": false
  },
  "operatorSetHash": "6abd72be35a7910fdbd9c179d8f292509f25a6dc44a3c29e2fba40dd3359dbd5",
  "totals": {
    "variants": 2765,
    "unresolved": 0,
    "unstable": 0,
    "controls": 946,
    "detectionPreserved": 986,
    "legacyDetectionPreserved": 1254,
    "leakedSpans": 833,
    "legacyLeakedSpans": 565,
    "leakedOnlyUnderCandidate": 268,
    "falseAlarms": 284,
    "legacyFalseAlarms": 371,
    "mustRedactBytes": 111601,
    "collateralBytes": 16755,
    "legacyCollateralBytes": 21780,
    "negativeEvidenceApplied": 10,
    "negativeEvidenceOnPartialMatch": 0
  },
  "attackClasses": {
    "controlled-repetition": {
      "variants": 259,
      "unresolved": 0,
      "unstable": 0,
      "controls": 70,
      "detectionPreserved": 75,
      "legacyDetectionPreserved": 140,
      "leakedSpans": 114,
      "legacyLeakedSpans": 49,
      "leakedOnlyUnderCandidate": 65,
      "falseAlarms": 21,
      "legacyFalseAlarms": 32,
      "mustRedactBytes": 12302,
      "collateralBytes": 1419,
      "legacyCollateralBytes": 2024,
      "negativeEvidenceApplied": 0,
      "negativeEvidenceOnPartialMatch": 0
    },
    "periodic-body": {
      "variants": 264,
      "unresolved": 0,
      "unstable": 0,
      "controls": 129,
      "detectionPreserved": 39,
      "legacyDetectionPreserved": 107,
      "leakedSpans": 96,
      "legacyLeakedSpans": 28,
      "leakedOnlyUnderCandidate": 68,
      "falseAlarms": 60,
      "legacyFalseAlarms": 71,
      "mustRedactBytes": 6885,
      "collateralBytes": 2177,
      "legacyCollateralBytes": 2714,
      "negativeEvidenceApplied": 0,
      "negativeEvidenceOnPartialMatch": 0
    },
    "class-distribution": {
      "variants": 192,
      "unresolved": 0,
      "unstable": 0,
      "controls": 53,
      "detectionPreserved": 62,
      "legacyDetectionPreserved": 104,
      "leakedSpans": 77,
      "legacyLeakedSpans": 35,
      "leakedOnlyUnderCandidate": 42,
      "falseAlarms": 17,
      "legacyFalseAlarms": 25,
      "mustRedactBytes": 7326,
      "collateralBytes": 899,
      "legacyCollateralBytes": 1258,
      "negativeEvidenceApplied": 0,
      "negativeEvidenceOnPartialMatch": 0
    },
    "length-segmentation": {
      "variants": 292,
      "unresolved": 0,
      "unstable": 0,
      "controls": 78,
      "detectionPreserved": 81,
      "legacyDetectionPreserved": 118,
      "leakedSpans": 133,
      "legacyLeakedSpans": 96,
      "leakedOnlyUnderCandidate": 37,
      "falseAlarms": 21,
      "legacyFalseAlarms": 35,
      "mustRedactBytes": 10413,
      "collateralBytes": 1014,
      "legacyCollateralBytes": 2343,
      "negativeEvidenceApplied": 0,
      "negativeEvidenceOnPartialMatch": 0
    },
    "placeholder-wrapping": {
      "variants": 296,
      "unresolved": 0,
      "unstable": 0,
      "controls": 80,
      "detectionPreserved": 135,
      "legacyDetectionPreserved": 137,
      "leakedSpans": 81,
      "legacyLeakedSpans": 79,
      "leakedOnlyUnderCandidate": 2,
      "falseAlarms": 36,
      "legacyFalseAlarms": 37,
      "mustRedactBytes": 11016,
      "collateralBytes": 1945,
      "legacyCollateralBytes": 1985,
      "negativeEvidenceApplied": 0,
      "negativeEvidenceOnPartialMatch": 0
    },
    "embedded-reference": {
      "variants": 296,
      "unresolved": 0,
      "unstable": 0,
      "controls": 80,
      "detectionPreserved": 129,
      "legacyDetectionPreserved": 129,
      "leakedSpans": 87,
      "legacyLeakedSpans": 87,
      "leakedOnlyUnderCandidate": 0,
      "falseAlarms": 23,
      "legacyFalseAlarms": 25,
      "mustRedactBytes": 11394,
      "collateralBytes": 1212,
      "legacyCollateralBytes": 1267,
      "negativeEvidenceApplied": 0,
      "negativeEvidenceOnPartialMatch": 0
    },
    "context-perturbation": {
      "variants": 363,
      "unresolved": 0,
      "unstable": 0,
      "controls": 100,
      "detectionPreserved": 241,
      "legacyDetectionPreserved": 241,
      "leakedSpans": 22,
      "legacyLeakedSpans": 22,
      "leakedOnlyUnderCandidate": 0,
      "falseAlarms": 53,
      "legacyFalseAlarms": 63,
      "mustRedactBytes": 12609,
      "collateralBytes": 2752,
      "legacyCollateralBytes": 3072,
      "negativeEvidenceApplied": 0,
      "negativeEvidenceOnPartialMatch": 0
    },
    "negative-evidence-mixture": {
      "variants": 451,
      "unresolved": 0,
      "unstable": 0,
      "controls": 262,
      "detectionPreserved": 129,
      "legacyDetectionPreserved": 131,
      "leakedSpans": 60,
      "legacyLeakedSpans": 58,
      "leakedOnlyUnderCandidate": 2,
      "falseAlarms": 32,
      "legacyFalseAlarms": 44,
      "mustRedactBytes": 9639,
      "collateralBytes": 1835,
      "legacyCollateralBytes": 2127,
      "negativeEvidenceApplied": 10,
      "negativeEvidenceOnPartialMatch": 0
    },
    "boundary-discontinuity": {
      "variants": 352,
      "unresolved": 0,
      "unstable": 0,
      "controls": 94,
      "detectionPreserved": 95,
      "legacyDetectionPreserved": 147,
      "leakedSpans": 163,
      "legacyLeakedSpans": 111,
      "leakedOnlyUnderCandidate": 52,
      "falseAlarms": 21,
      "legacyFalseAlarms": 39,
      "mustRedactBytes": 30017,
      "collateralBytes": 3502,
      "legacyCollateralBytes": 4990,
      "negativeEvidenceApplied": 0,
      "negativeEvidenceOnPartialMatch": 0
    }
  },
  "invariants": {
    "protectedSpecificityNeverWeakened": true,
    "negativeEvidenceFullGrammarOnly": true,
    "noStatisticalPositiveToNonFinding": true,
    "shadowNonEnforcing": true
  }
}
