{
  "schemaVersion": 1,
  "reportType": "score-evasion-aggregate",
  "visibility": "public-aggregate",
  "mode": "shadow",
  "holdoutAccess": "none",
  "identity": {
    "sourceRevision": "93ddf510a31563d58c7d4c202363ef65c4d92d55",
    "candidateArtifactHash": "99f4d159068955e33dabe354612b67c257960f0facb696c5064a40e408498fd5",
    "scoringArtifactRevision": 3,
    "modelFingerprint": "4104fb2c6f046169f63e991dd7594c099af5fcea01deecae7afe1c7015579975",
    "scoringArtifactSha256": "eb929a09af8d896463c57371c6a5948fce05f38d99dd3b0bb5bc8d14fcb7a6cf",
    "tuningManifestHash": null,
    "scoringIdentity": "838aa57db8e2331c8540a42da823ffda8802d681952f4dc7af20e6001c5693a2"
  },
  "benchmark": {
    "commit": "853149ffbb2c8efef89e5c74178bf61ee783da7d",
    "dirty": false
  },
  "operatorSetHash": "2112cbb297370a15704f0049fd441ef8a1388cd991abbc3e94af0a2b2698552a",
  "totals": {
    "variants": 2763,
    "unresolved": 0,
    "unstable": 0,
    "controls": 946,
    "detectionPreserved": 1106,
    "legacyDetectionPreserved": 1277,
    "leakedSpans": 711,
    "legacyLeakedSpans": 540,
    "leakedOnlyUnderCandidate": 171,
    "falseAlarms": 361,
    "legacyFalseAlarms": 371,
    "mustRedactBytes": 110925,
    "collateralBytes": 21614,
    "legacyCollateralBytes": 21834,
    "negativeEvidenceApplied": 10,
    "negativeEvidenceOnPartialMatch": 0
  },
  "attackClasses": {
    "controlled-repetition": {
      "variants": 259,
      "unresolved": 0,
      "unstable": 0,
      "controls": 70,
      "detectionPreserved": 125,
      "legacyDetectionPreserved": 143,
      "leakedSpans": 64,
      "legacyLeakedSpans": 46,
      "leakedOnlyUnderCandidate": 18,
      "falseAlarms": 32,
      "legacyFalseAlarms": 32,
      "mustRedactBytes": 12204,
      "collateralBytes": 2024,
      "legacyCollateralBytes": 2024,
      "negativeEvidenceApplied": 0,
      "negativeEvidenceOnPartialMatch": 0
    },
    "periodic-body": {
      "variants": 264,
      "unresolved": 0,
      "unstable": 0,
      "controls": 129,
      "detectionPreserved": 95,
      "legacyDetectionPreserved": 112,
      "leakedSpans": 40,
      "legacyLeakedSpans": 23,
      "leakedOnlyUnderCandidate": 17,
      "falseAlarms": 71,
      "legacyFalseAlarms": 71,
      "mustRedactBytes": 6840,
      "collateralBytes": 2714,
      "legacyCollateralBytes": 2714,
      "negativeEvidenceApplied": 0,
      "negativeEvidenceOnPartialMatch": 0
    },
    "class-distribution": {
      "variants": 193,
      "unresolved": 0,
      "unstable": 0,
      "controls": 53,
      "detectionPreserved": 86,
      "legacyDetectionPreserved": 110,
      "leakedSpans": 54,
      "legacyLeakedSpans": 30,
      "leakedOnlyUnderCandidate": 24,
      "falseAlarms": 25,
      "legacyFalseAlarms": 25,
      "mustRedactBytes": 7321,
      "collateralBytes": 1258,
      "legacyCollateralBytes": 1258,
      "negativeEvidenceApplied": 0,
      "negativeEvidenceOnPartialMatch": 0
    },
    "length-segmentation": {
      "variants": 292,
      "unresolved": 0,
      "unstable": 0,
      "controls": 78,
      "detectionPreserved": 118,
      "legacyDetectionPreserved": 118,
      "leakedSpans": 96,
      "legacyLeakedSpans": 96,
      "leakedOnlyUnderCandidate": 0,
      "falseAlarms": 35,
      "legacyFalseAlarms": 35,
      "mustRedactBytes": 10389,
      "collateralBytes": 2343,
      "legacyCollateralBytes": 2343,
      "negativeEvidenceApplied": 0,
      "negativeEvidenceOnPartialMatch": 0
    },
    "placeholder-wrapping": {
      "variants": 296,
      "unresolved": 0,
      "unstable": 0,
      "controls": 80,
      "detectionPreserved": 125,
      "legacyDetectionPreserved": 137,
      "leakedSpans": 91,
      "legacyLeakedSpans": 79,
      "leakedOnlyUnderCandidate": 12,
      "falseAlarms": 37,
      "legacyFalseAlarms": 37,
      "mustRedactBytes": 10944,
      "collateralBytes": 1985,
      "legacyCollateralBytes": 1985,
      "negativeEvidenceApplied": 0,
      "negativeEvidenceOnPartialMatch": 0
    },
    "embedded-reference": {
      "variants": 296,
      "unresolved": 0,
      "unstable": 0,
      "controls": 80,
      "detectionPreserved": 98,
      "legacyDetectionPreserved": 134,
      "leakedSpans": 118,
      "legacyLeakedSpans": 82,
      "leakedOnlyUnderCandidate": 36,
      "falseAlarms": 25,
      "legacyFalseAlarms": 25,
      "mustRedactBytes": 11322,
      "collateralBytes": 1338,
      "legacyCollateralBytes": 1338,
      "negativeEvidenceApplied": 0,
      "negativeEvidenceOnPartialMatch": 0
    },
    "context-perturbation": {
      "variants": 362,
      "unresolved": 0,
      "unstable": 0,
      "controls": 100,
      "detectionPreserved": 194,
      "legacyDetectionPreserved": 240,
      "leakedSpans": 68,
      "legacyLeakedSpans": 22,
      "leakedOnlyUnderCandidate": 46,
      "falseAlarms": 63,
      "legacyFalseAlarms": 63,
      "mustRedactBytes": 12456,
      "collateralBytes": 3055,
      "legacyCollateralBytes": 3055,
      "negativeEvidenceApplied": 0,
      "negativeEvidenceOnPartialMatch": 0
    },
    "negative-evidence-mixture": {
      "variants": 451,
      "unresolved": 0,
      "unstable": 0,
      "controls": 262,
      "detectionPreserved": 119,
      "legacyDetectionPreserved": 131,
      "leakedSpans": 70,
      "legacyLeakedSpans": 58,
      "leakedOnlyUnderCandidate": 12,
      "falseAlarms": 34,
      "legacyFalseAlarms": 44,
      "mustRedactBytes": 9576,
      "collateralBytes": 1907,
      "legacyCollateralBytes": 2127,
      "negativeEvidenceApplied": 10,
      "negativeEvidenceOnPartialMatch": 0
    },
    "boundary-discontinuity": {
      "variants": 350,
      "unresolved": 0,
      "unstable": 0,
      "controls": 94,
      "detectionPreserved": 146,
      "legacyDetectionPreserved": 152,
      "leakedSpans": 110,
      "legacyLeakedSpans": 104,
      "leakedOnlyUnderCandidate": 6,
      "falseAlarms": 39,
      "legacyFalseAlarms": 39,
      "mustRedactBytes": 29873,
      "collateralBytes": 4990,
      "legacyCollateralBytes": 4990,
      "negativeEvidenceApplied": 0,
      "negativeEvidenceOnPartialMatch": 0
    }
  },
  "invariants": {
    "protectedSpecificityNeverWeakened": true,
    "negativeEvidenceFullGrammarOnly": true,
    "noStatisticalPositiveToNonFinding": true,
    "shadowNonEnforcing": true
  }
}
